{
  "$ref": "#/definitions/projects",
  "definitions": {
    "projects": {
      "type": "object",
      "properties": {
        "name": {
          "type": "string"
        },
        "description": {
          "type": "string"
        },
        "url": {
          "type": "string",
          "format": "uri"
        },
        "isPublished": {
          "type": "boolean",
          "default": false
        },
        "github": {
          "type": "string",
          "format": "uri"
        },
        "createdAt": {
          "type": "string"
        },
        "updatedAt": {
          "type": "string"
        },
        "$schema": {
          "type": "string"
        }
      },
      "required": [
        "name",
        "description",
        "url",
        "createdAt",
        "updatedAt"
      ],
      "additionalProperties": false
    }
  },
  "$schema": "http://json-schema.org/draft-07/schema#"
}