{
    "name": "dam-janun",
    "description": "A react project to show prices of the same book in different shops in Bangladesh.",
    "url": "https://github.com/sh4hids/dam-janun",
    "github": "https://github.com/sh4hids/dam-janun",
    "createdAt": "2024-05-15T15:17:25.091Z",
    "updatedAt": "2024-05-15T15:17:25.091Z",
    "isPublished": true
}
