{
    "name": "roshui-pronali",
    "description": "A Bnagla recipe website built with Astro, React, and TailwindCSS",
    "url": "https://roshuipronali.shahid.pro/",
    "github": "https://github.com/sh4hids/roshui-pronali",
    "createdAt": "2023-11-02T01:11:23.742Z",
    "updatedAt": "2023-11-02T01:11:23.742Z",
    "isPublished": true
}
