{
    "name": "gatsby-theme-open-sourcerer",
    "description": "A configurable minimal gatsby portfolio theme for open source developers.",
    "url": "https://gatsby-theme-open-sourcerer.netlify.app/",
    "github": "https://github.com/sh4hids/gatsby-theme-open-sourcerer",
    "createdAt": "2024-05-15T15:12:18.875Z",
    "updatedAt": "2024-05-15T15:12:18.875Z",
    "isPublished": true
}
