{
    "name": "bangla-calendar",
    "description": "A small JavaScript library to convert any valid JavaScript date to Bangla date.",
    "url": "https://github.com/sh4hids/bangla-calendar",
    "github": "https://github.com/sh4hids/bangla-calendar",
    "createdAt": "2023-11-02T01:11:23.742Z",
    "updatedAt": "2023-11-02T01:11:23.742Z",
    "isPublished": true
}
