{
    "name": "prayertiming-cli",
    "description": "A command line tool to show Muslim prayer times based on coordinates.",
    "url": "https://github.com/sh4hids/prayertiming-cli",
    "github": "https://github.com/sh4hids/prayertiming-cli",
    "createdAt": "2024-05-15T15:11:07.146Z",
    "updatedAt": "2024-05-15T15:11:07.146Z",
    "isPublished": true
}
