{
    "name": "deskaide",
    "description": "An electron based desktop application to help managing pc usage.",
    "url": "https://github.com/deskaide/deskaide",
    "github": "https://github.com/deskaide/deskaide",
    "isPublished": true,
    "createdAt": "2023-11-02T01:11:23.742Z",
    "updatedAt": "2023-11-02T01:11:23.742Z"
}
