{
    "name": "prozuktischool.com",
    "description": "An open source bangla community blog site build with Gatsby and Styled Components.",
    "url": "https://prozuktischool.com",
    "github": "https://github.com/prozuktischool/prozuktischool.com",
    "createdAt": "2023-11-02T01:11:23.742Z",
    "updatedAt": "2023-11-02T01:11:23.742Z",
    "isPublished": true
}
